{
  "schemaVersion": 1,
  "profile": {
    "name": "Abdul Hakim Norazman",
    "title": "Senior backend and platform engineer building reliable, data-intensive systems",
    "summary": "Technology consultant at Detillens, contracted to Morgan Stanley in Fund Services Technology. I specialise in Java and Spring backend systems, database and JVM performance, distributed workflow reliability and evidence-led production engineering, alongside independent products built with Python, TypeScript and PostgreSQL.",
    "updated": "October 2026",
    "contacts": [
      {
        "label": "Email",
        "href": "mailto:ahnorazman@gmail.com"
      },
      {
        "label": "LinkedIn",
        "href": "https://www.linkedin.com/in/abdulhakimnorazman/"
      },
      {
        "label": "GitHub",
        "href": "https://github.com/FLABDUL"
      }
    ]
  },
  "overview": [
    {
      "id": "2018-present",
      "value": "2018 - present",
      "label": "Engineering, leadership and professional work"
    },
    {
      "id": "finance-technology",
      "value": "Finance + technology",
      "label": "From trading and research platforms to fund services"
    },
    {
      "id": "build-operate-teach",
      "value": "Build, operate, teach",
      "label": "Production systems, independent projects and technical workshops"
    }
  ],
  "jumpLinks": [
    {
      "label": "Experience",
      "href": "#professional-experience"
    },
    {
      "label": "Engineering work",
      "href": "#engineering-work"
    },
    {
      "label": "University",
      "href": "#university"
    },
    {
      "label": "Leadership & impact",
      "href": "#leadership-impact"
    },
    {
      "label": "Development",
      "href": "#professional-development"
    },
    {
      "label": "Skills",
      "href": "#technical-skills"
    }
  ],
  "achievements": [
    {
      "id": "ms-n-plus-one-lookups",
      "roleId": "technology-consultant-and-software-engineer",
      "text": "Eliminated an N+1 database lookup in a high-volume statement-generation service, reducing allocation-type lookups from 103 to 2 per request and removing about 220,000 production database round-trips per business day.",
      "cvText": "Eliminated an N+1 database lookup, reducing allocation lookups from 103 to 2 per request and removing about 220,000 production database round-trips per business day.",
      "ownership": "confirmed",
      "validation": "production",
      "scope": "Per request and per business day",
      "tags": ["Java", "Spring", "Database", "Performance"]
    },
    {
      "id": "ms-upstream-allocation-fetch",
      "roleId": "technology-consultant-and-software-engineer",
      "text": "Redesigned a returns-calculation data fetch to make one lean, deduplicated upstream call per fund, making the median fetch 13.9 times faster and reducing the worst production case from 31 minutes to 10 seconds.",
      "cvText": "Redesigned an upstream data fetch around one lean call per fund; production measurements were 13.9 times faster at the median and reduced the worst case from 31 minutes to 10 seconds.",
      "ownership": "confirmed",
      "validation": "production",
      "scope": "Fetch step across all funds",
      "tags": ["Java", "API", "Distributed systems", "Performance"]
    },
    {
      "id": "ms-right-sized-data-fetches",
      "roleId": "technology-consultant-and-software-engineer",
      "text": "Fixed deterministic out-of-memory failures on the largest client funds by right-sizing data fetches; UAT showed a previously failing fund completing and another running about 36 times faster with 15-57 times less allocated and promoted memory.",
      "cvText": "Fixed deterministic out-of-memory failures by right-sizing data fetches; UAT showed a failed case completing and another running about 36 times faster with 15-57 times less allocated and promoted memory.",
      "ownership": "confirmed",
      "validation": "uat",
      "scope": "Largest-fund data fetches",
      "tags": ["Java", "JVM", "Memory", "Reliability"]
    },
    {
      "id": "ms-lean-stored-procedure-adoption",
      "roleId": "technology-consultant-and-software-engineer",
      "text": "Led adoption of lean upstream-owned stored procedures using 14 of about 230 columns and fixed a join-fanout defect; UAT cut payloads by 94-95%, made one fetch up to 18 times faster and brought a previously failing 72-minute case below four minutes.",
      "cvText": "Led adoption of lean upstream-owned stored procedures and fixed a join fanout; UAT cut payloads by 94-95%, made one fetch up to 18 times faster and brought a failed 72-minute case below four minutes.",
      "ownership": "confirmed",
      "validation": "uat",
      "scope": "Allocation data-fetch path",
      "tags": ["SQL", "Database", "Leadership", "Performance"]
    },
    {
      "id": "ms-parallel-call-deduplication",
      "roleId": "technology-consultant-and-software-engineer",
      "text": "Deduplicated redundant upstream calls across parallel calculation branches, reducing calls per run by 64% and avoiding about 6,900 production calls per month.",
      "cvText": "Deduplicated parallel upstream calls, reducing calls per run by 64% and avoiding about 6,900 production calls per month.",
      "ownership": "confirmed",
      "validation": "production",
      "scope": "Parallel calculation branches",
      "tags": ["Distributed systems", "Concurrency", "Performance"]
    },
    {
      "id": "ms-dag-failure-isolation",
      "roleId": "technology-consultant-and-software-engineer",
      "text": "Restructured a workflow dependency graph so one task failure invalidates two downstream tasks instead of eight, a 75% reduction validated in UAT, preventing unrelated investor-report work from waiting on the failure.",
      "cvText": "Restructured a workflow dependency graph so one failure invalidates two downstream tasks instead of eight, a 75% reduction validated in UAT.",
      "ownership": "confirmed",
      "validation": "uat",
      "scope": "Workflow dependency graph",
      "tags": ["Architecture", "Distributed systems", "Reliability"]
    },
    {
      "id": "ms-jvm-container-sizing",
      "roleId": "technology-consultant-and-software-engineer",
      "text": "Diagnosed JVM and container mis-sizing across four services, correcting a 127-CPU JVM view on 2-4-core containers, a profile-selection heap defect and manual production memory overrides through configuration as code.",
      "cvText": "Corrected JVM/container sizing across four services, including a 127-CPU JVM view on 2-4-core containers, a heap-profile defect and manual production memory overrides.",
      "ownership": "confirmed",
      "validation": "production",
      "scope": "Four-service JVM fleet",
      "tags": ["Java", "JVM", "Containers", "Reliability"]
    },
    {
      "id": "ms-minimal-reference-data-mode",
      "roleId": "technology-consultant-and-software-engineer",
      "text": "Added an opt-in minimal-reference-data mode to a downstream reporting API, removing all 15 downstream calls per request; validated in UAT, with production adoption owned by the calling team.",
      "cvText": "Added an opt-in API mode that removes all 15 downstream calls per request; validated in UAT, with production adoption owned by the calling team.",
      "ownership": "confirmed",
      "validation": "uat",
      "scope": "Opt-in API request mode",
      "tags": ["API", "Architecture", "Database", "Performance"]
    },
    {
      "id": "ms-prometheus-onboarding",
      "roleId": "technology-consultant-and-software-engineer",
      "text": "Onboarded an API gateway service to Prometheus and replaced stale, crash-looping monitors with working production telemetry, enabling fleet-wide out-of-memory and heap tracking.",
      "cvText": "Onboarded an API gateway to Prometheus and replaced stale monitors with production telemetry for fleet-wide out-of-memory and heap tracking.",
      "ownership": "confirmed",
      "validation": "production",
      "scope": "API gateway and service fleet telemetry",
      "tags": ["Prometheus", "Observability", "Reliability"]
    },
    {
      "id": "ms-recurring-database-failure",
      "roleId": "technology-consultant-and-software-engineer",
      "text": "Eliminated a recurring production database failure caused by temporary-table name collisions under concurrency, reducing 2,285 incidents across 84% of business days to zero after release, confirmed in two independent log sources.",
      "cvText": "Eliminated a concurrency-related production database failure, reducing 2,285 recurring incidents across 84% of business days to zero after release.",
      "ownership": "confirmed",
      "validation": "production",
      "scope": "Recurring concurrency failure",
      "tags": ["Database", "Concurrency", "Reliability", "Production"]
    },
    {
      "id": "ms-parallel-returns-calculation",
      "roleId": "technology-consultant-and-software-engineer",
      "text": "Parallelised a three-way returns calculation, making that production step 54% faster across all funds and 50% faster on the largest fund.",
      "cvText": "Parallelised a three-way returns calculation, making that production step 54% faster across all funds and 50% faster on the largest fund.",
      "ownership": "confirmed",
      "validation": "production",
      "scope": "Returns-calculation step only",
      "tags": ["Java", "Concurrency", "Performance"]
    },
    {
      "id": "ms-connection-pool-leak",
      "roleId": "technology-consultant-and-software-engineer",
      "text": "Fixed connection leaks behind a production database-pool exhaustion incident and added pool-usage gauges; a load test drove the pool to its 20-connection limit, completed all 204 requests and returned usage to zero within about 30 seconds ahead of production release.",